{
  "schemaVersion": 4,
  "chainId": 4663,
  "dropId": "0x3333333333333333333333333333333333333333333333333333333333333333",
  "rewardAsset": {
    "tokenAddress": "0x4EA005168D7F09a7A0Ba9D1DEf21a479950E44C2",
    "distributorAddress": "0x00000000000000000000000000000000000000D4",
    "symbol": "COST",
    "name": "Costco Robinhood Stock Token",
    "decimals": 18
  },
  "assetContextHash": "0xe28ae785edc5af2b5e94033bd7ea827a026976df4a43bedc71a227626c64951c",
  "window": {
    "sequence": 1,
    "startBlock": "100",
    "endBlock": "200",
    "rulesVersion": "1.0.0",
    "rulesPath": "rules/RULES-v1.md",
    "rulesSha256": "b80cc1e93fac35292aa1bce7beb537e4cd5f181260d3f35d01889a4dfbc797b9"
  },
  "rewardAmount": "1000",
  "funding": {
    "mode": "shared_drop_bps",
    "holderRewardAmount": "750",
    "communityRewardAmount": "250",
    "communityBps": 2500
  },
  "holderPool": {
    "rewardAmount": "750",
    "floorTokenAmount": "100",
    "eligibleCount": 2,
    "totalWeight": "200",
    "snapshotHash": "0xa4ad82c941553ef1a52bbf3dc8d08f42d0287ebd1437c9f9193cafedfbf3089a",
    "snapshot": [
      {
        "address": "0x00000000000000000000000000000000000000A1",
        "minimumBalance": "100",
        "streak": 1,
        "excluded": false
      },
      {
        "address": "0x00000000000000000000000000000000000000C3",
        "minimumBalance": "100",
        "streak": 1,
        "excluded": false
      }
    ],
    "allocations": [
      {
        "address": "0x00000000000000000000000000000000000000A1",
        "minimumBalance": "100",
        "streak": 1,
        "multiplierBps": "10000",
        "weight": "100",
        "amount": "375"
      },
      {
        "address": "0x00000000000000000000000000000000000000C3",
        "minimumBalance": "100",
        "streak": 1,
        "multiplierBps": "10000",
        "weight": "100",
        "amount": "375"
      }
    ]
  },
  "communityPool": {
    "rewardAmount": "250",
    "contributorCount": 2,
    "totalPoints": "20",
    "score": {
      "schemaVersion": 1,
      "round": {
        "id": "00000000-0000-4000-8000-000000000101",
        "sequence": 1,
        "startTime": 1800000000,
        "endTime": 1800086400,
        "rulesVersion": "0-test-vector",
        "rulesPath": "rules/COMMUNITY-RULES-v0-test-vector.md",
        "rulesSha256": "524081f522700b632c6f82d98a62e39b2d5d99127f50c4a9c10e669a7938de9d"
      },
      "rules": [
        {
          "action": "educational_post",
          "points": "5",
          "perUtcDay": 2,
          "perRound": 2
        },
        {
          "action": "project_work",
          "points": "15",
          "perUtcDay": 1,
          "perRound": 1
        }
      ],
      "approvedEvents": [
        {
          "eventCommitment": "0x1111111111111111111111111111111111111111111111111111111111111111",
          "address": "0x00000000000000000000000000000000000000A1",
          "action": "educational_post",
          "occurredAt": 1800000100
        },
        {
          "eventCommitment": "0x2222222222222222222222222222222222222222222222222222222222222222",
          "address": "0x00000000000000000000000000000000000000b2",
          "action": "project_work",
          "occurredAt": 1800000200
        }
      ],
      "excludedAddresses": [],
      "contributors": [
        {
          "address": "0x00000000000000000000000000000000000000A1",
          "points": "5",
          "acceptedEvents": 1
        },
        {
          "address": "0x00000000000000000000000000000000000000b2",
          "points": "15",
          "acceptedEvents": 1
        }
      ],
      "acceptedEvents": [
        {
          "eventCommitment": "0x1111111111111111111111111111111111111111111111111111111111111111",
          "address": "0x00000000000000000000000000000000000000A1",
          "action": "educational_post",
          "occurredAt": 1800000100,
          "points": "5"
        },
        {
          "eventCommitment": "0x2222222222222222222222222222222222222222222222222222222222222222",
          "address": "0x00000000000000000000000000000000000000b2",
          "action": "project_work",
          "occurredAt": 1800000200,
          "points": "15"
        }
      ],
      "rejectedEvents": [],
      "totalPoints": "20",
      "inputCommitment": "0x54669af9b881b66b73c7ab3f2d16dff41bac6506ce2060072136f748d3401365",
      "outputCommitment": "0x1f23d17a9a9ffd06750770806c562d76edd70d70d96a7b2833897be4b320fdb5"
    },
    "allocations": [
      {
        "address": "0x00000000000000000000000000000000000000A1",
        "points": "5",
        "acceptedEvents": 1,
        "amount": "63"
      },
      {
        "address": "0x00000000000000000000000000000000000000b2",
        "points": "15",
        "acceptedEvents": 1,
        "amount": "187"
      }
    ]
  },
  "recipientCount": 3,
  "allocationRoot": "0x606f5664f0a98dfee71aa8a849df27d7c954ce23a8fca0603b1a60f10d8f2726",
  "batchesRoot": "0x2adec5f6a95ebe3c8fc95dd5c4badabf2c85c2f0071b3e7f0349ed72bf893066",
  "expectedBatches": 1,
  "safeCreateDropCalldata": "0x183ec1463333333333333333333333333333333333333333333333333333333333333333606f5664f0a98dfee71aa8a849df27d7c954ce23a8fca0603b1a60f10d8f27262adec5f6a95ebe3c8fc95dd5c4badabf2c85c2f0071b3e7f0349ed72bf89306600000000000000000000000000000000000000000000000000000000000003e80000000000000000000000000000000000000000000000000000000000000001",
  "safeFinalizeDropCalldata": "0xd1ffe5903333333333333333333333333333333333333333333333333333333333333333",
  "safeCreateDropTransaction": {
    "to": "0x00000000000000000000000000000000000000D4",
    "value": "0",
    "data": "0x183ec1463333333333333333333333333333333333333333333333333333333333333333606f5664f0a98dfee71aa8a849df27d7c954ce23a8fca0603b1a60f10d8f27262adec5f6a95ebe3c8fc95dd5c4badabf2c85c2f0071b3e7f0349ed72bf89306600000000000000000000000000000000000000000000000000000000000003e80000000000000000000000000000000000000000000000000000000000000001"
  },
  "safeFinalizeDropTransaction": {
    "to": "0x00000000000000000000000000000000000000D4",
    "value": "0",
    "data": "0xd1ffe5903333333333333333333333333333333333333333333333333333333333333333"
  },
  "allocations": [
    {
      "address": "0x00000000000000000000000000000000000000A1",
      "holderAmount": "375",
      "communityAmount": "63",
      "amount": "438",
      "leaf": "0xa85b8faf76ba6ef8da9eb3f05c2f5795ade8b0ec43cf18acf998c42121c89103",
      "proof": [
        "0x2e66162ecf32dd873bb1874d45f6b6e93d7500d24182db702e3a43e65716d8dd",
        "0xfa88f38cd0d62eb1b70da8ec6eee5519dd9b77f33a10777225d3373575169b41"
      ]
    },
    {
      "address": "0x00000000000000000000000000000000000000b2",
      "holderAmount": "0",
      "communityAmount": "187",
      "amount": "187",
      "leaf": "0x2e66162ecf32dd873bb1874d45f6b6e93d7500d24182db702e3a43e65716d8dd",
      "proof": [
        "0xa85b8faf76ba6ef8da9eb3f05c2f5795ade8b0ec43cf18acf998c42121c89103",
        "0xfa88f38cd0d62eb1b70da8ec6eee5519dd9b77f33a10777225d3373575169b41"
      ]
    },
    {
      "address": "0x00000000000000000000000000000000000000C3",
      "holderAmount": "375",
      "communityAmount": "0",
      "amount": "375",
      "leaf": "0xfa88f38cd0d62eb1b70da8ec6eee5519dd9b77f33a10777225d3373575169b41",
      "proof": [
        "0xb7b57a95efab1019f518fd4418740dc46027d50f69f97fe2e0342b25819c252f"
      ]
    }
  ],
  "batches": [
    {
      "index": 0,
      "recipients": [
        "0x00000000000000000000000000000000000000A1",
        "0x00000000000000000000000000000000000000b2",
        "0x00000000000000000000000000000000000000C3"
      ],
      "amounts": [
        "438",
        "187",
        "375"
      ],
      "batchHash": "0x6ec7872cf3ecebde3961db7091857fd22b95f2934f7be93d5dc7966af28f7c4f",
      "leaf": "0x2adec5f6a95ebe3c8fc95dd5c4badabf2c85c2f0071b3e7f0349ed72bf893066",
      "proof": [],
      "operatorCalldata": "0x01baf7273333333333333333333333333333333333333333333333333333333333333333000000000000000000000000000000000000000000000000000000000000000000000000000000000000000000000000000000000000000000000000000000a0000000000000000000000000000000000000000000000000000000000000012000000000000000000000000000000000000000000000000000000000000001a0000000000000000000000000000000000000000000000000000000000000000300000000000000000000000000000000000000000000000000000000000000a100000000000000000000000000000000000000000000000000000000000000b200000000000000000000000000000000000000000000000000000000000000c3000000000000000000000000000000000000000000000000000000000000000300000000000000000000000000000000000000000000000000000000000001b600000000000000000000000000000000000000000000000000000000000000bb00000000000000000000000000000000000000000000000000000000000001770000000000000000000000000000000000000000000000000000000000000000",
      "operatorTransaction": {
        "to": "0x00000000000000000000000000000000000000D4",
        "value": "0",
        "data": "0x01baf7273333333333333333333333333333333333333333333333333333333333333333000000000000000000000000000000000000000000000000000000000000000000000000000000000000000000000000000000000000000000000000000000a0000000000000000000000000000000000000000000000000000000000000012000000000000000000000000000000000000000000000000000000000000001a0000000000000000000000000000000000000000000000000000000000000000300000000000000000000000000000000000000000000000000000000000000a100000000000000000000000000000000000000000000000000000000000000b200000000000000000000000000000000000000000000000000000000000000c3000000000000000000000000000000000000000000000000000000000000000300000000000000000000000000000000000000000000000000000000000001b600000000000000000000000000000000000000000000000000000000000000bb00000000000000000000000000000000000000000000000000000000000001770000000000000000000000000000000000000000000000000000000000000000"
      }
    }
  ]
}
